{
  "$schema": "https://json-schema.org/draft/2020-12/schema",
  "$id": "https://roundcraft.app/contracts/progress-response.json",
  "title": "Progress response",
  "type": "object",
  "additionalProperties": false,
  "required": ["ok", "data", "error", "meta"],
  "properties": {
    "ok": { "const": true },
    "data": {
      "type": "object",
      "additionalProperties": false,
      "required": ["entries"],
      "properties": {
        "entries": {
          "type": "array",
          "items": {
            "type": "object",
            "additionalProperties": false,
            "required": [
              "edition_id", "state", "total_score",
              "display_main", "display_evidence", "display_followup",
              "issued_at"
            ],
            "properties": {
              "edition_id": {
                "type": "string",
                "pattern": "^[a-z0-9_]+$",
                "maxLength": 80
              },
              "state": {
                "enum": ["decision_complete", "debrief_complete"]
              },
              "total_score": {
                "type": "integer",
                "minimum": 0,
                "maximum": 100
              },
              "display_main": {
                "type": "integer",
                "minimum": 0,
                "maximum": 50
              },
              "display_evidence": {
                "type": "integer",
                "minimum": 0,
                "maximum": 20
              },
              "display_followup": {
                "type": "integer",
                "minimum": 0,
                "maximum": 30
              },
              "issued_at": {
                "type": "string",
                "pattern": "^\\d{4}-\\d{2}-\\d{2}T\\d{2}:\\d{2}:\\d{2}\\.\\d{3}Z$"
              },
              "debrief_completed_at": {
                "type": ["string", "null"],
                "pattern": "^\\d{4}-\\d{2}-\\d{2}T\\d{2}:\\d{2}:\\d{2}\\.\\d{3}Z$"
              }
            }
          }
        }
      }
    },
    "error": { "type": "null" },
    "meta": {
      "type": "object",
      "additionalProperties": false,
      "required": ["request_id", "api_version"],
      "properties": {
        "request_id": {
          "type": "string",
          "pattern": "^[0-9a-f]{8}-[0-9a-f]{4}-[1-5][0-9a-f]{3}-[89ab][0-9a-f]{3}-[0-9a-f]{12}$"
        },
        "api_version": { "const": "v1" }
      }
    }
  }
}
