{
  "ok": true,
  "data": {
    "entries": [
      {
        "edition_id": "edition_2026_09_01",
        "state": "debrief_complete",
        "total_score": 72,
        "display_main": 38,
        "display_evidence": 14,
        "display_followup": 20,
        "issued_at": "2026-09-01T08:30:00.000Z",
        "debrief_completed_at": "2026-09-01T09:15:00.000Z"
      }
    ]
  },
  "error": null,
  "meta": {
    "request_id": "b2c3d4e5-f6a7-4b8c-9d0e-f1a2b3c4d5e6",
    "api_version": "v1"
  }
}
